{
  "format": "ai-detection-spec/0.2",
  "platforms": [
    "darwin",
    "linux",
    "windows"
  ],
  "platform_groups": {
    "posix": [
      "darwin",
      "linux"
    ],
    "all": [
      "darwin",
      "linux",
      "windows"
    ]
  },
  "classifications": [
    {
      "name": "Coding agent",
      "definition": "Operates on a codebase, usually with shell access."
    },
    {
      "name": "Personal agent",
      "definition": "General-purpose, and often bridged to messaging."
    },
    {
      "name": "AI browser",
      "definition": "A browser whose AI features are the product."
    },
    {
      "name": "Browser agent",
      "definition": "An extension that acts inside the browser on the user's behalf."
    },
    {
      "name": "Desktop assistant",
      "definition": "A chat client that can run tools on the machine, for example through MCP."
    }
  ],
  "routes": {
    "bundle_ids": {
      "kind": "app",
      "match": "exact",
      "platform": "darwin",
      "value_pattern": "^[A-Za-z0-9-]+(\\.[A-Za-z0-9-]+){2,}$",
      "bindings": {
        "osquery": {
          "table": "apps",
          "min_osquery": "5.10.0"
        }
      }
    },
    "homebrew": {
      "kind": "brew",
      "match": "exact",
      "platform": "darwin",
      "bindings": {
        "osquery": {
          "table": "homebrew_packages",
          "min_osquery": "5.10.0"
        }
      }
    },
    "launchd_prefixes": {
      "kind": "daemon",
      "match": "prefix",
      "platform": "darwin",
      "bindings": {
        "osquery": {
          "table": "launchd",
          "min_osquery": "5.10.0"
        }
      }
    },
    "running_apps": {
      "kind": "proc",
      "match": "exact",
      "platform": "darwin",
      "values_from": "bundle_ids",
      "live": true,
      "bindings": {
        "osquery": {
          "table": "processes",
          "min_osquery": "5.10.0"
        }
      }
    },
    "npm": {
      "kind": "npm",
      "match": "exact",
      "platform": "all",
      "purl": "npm",
      "bindings": {
        "osquery": {
          "table": "npm_packages",
          "min_osquery": "5.10.0"
        }
      }
    },
    "running_npm": {
      "kind": "proc",
      "match": "exact",
      "platform": "all",
      "values_from": "npm",
      "live": true,
      "bindings": {
        "osquery": {
          "table": "processes",
          "min_osquery": "5.10.0"
        }
      }
    },
    "pypi": {
      "kind": "file",
      "match": "tool-dir",
      "platform": "all",
      "purl": "pypi",
      "bindings": {
        "osquery": {
          "table": "file",
          "min_osquery": "5.10.0"
        }
      }
    },
    "extension_ids": {
      "kind": "ext",
      "match": "exact",
      "platform": "all",
      "value_pattern": "^[a-p]{32}$",
      "purl": "chrome-extension",
      "bindings": {
        "osquery": {
          "table": "chrome_extensions",
          "min_osquery": "5.10.0"
        }
      }
    },
    "native_messaging_hosts": {
      "kind": "nmh",
      "match": "exact",
      "platform": "all",
      "bindings": {
        "osquery": {
          "table": "file",
          "min_osquery": "5.10.0"
        }
      }
    },
    "vscode_extensions": {
      "kind": "vscodeext",
      "match": "exact",
      "platform": "all",
      "value_pattern": "^[A-Za-z0-9][A-Za-z0-9._-]*\\.[A-Za-z0-9][A-Za-z0-9._-]*$",
      "purl": "vscode-extension",
      "bindings": {
        "osquery": {
          "table": "vscode_extensions",
          "min_osquery": "5.15.0"
        }
      }
    },
    "jetbrains_plugins": {
      "kind": "jbplugin",
      "match": "exact",
      "platform": "posix",
      "value_pattern": "^[A-Za-z0-9][A-Za-z0-9._-]*$",
      "bindings": {
        "osquery": {
          "table": "jetbrains_plugins",
          "min_osquery": "5.18.0"
        }
      }
    },
    "images": {
      "kind": "image",
      "match": "exact-normalised",
      "platform": "posix",
      "bindings": {
        "osquery": {
          "table": "docker_images",
          "min_osquery": "5.10.0"
        }
      }
    },
    "container_images": {
      "kind": "container",
      "match": "exact-normalised",
      "platform": "posix",
      "values_from": "images",
      "live": true,
      "bindings": {
        "osquery": {
          "table": "docker_containers",
          "min_osquery": "5.10.0"
        }
      }
    },
    "image_labels": {
      "kind": "ilabel",
      "match": "exact",
      "platform": "posix",
      "value_pattern": "^https?://[A-Za-z0-9.-]+/[A-Za-z0-9._~:/?#@!$&()*+,;=%-]+$",
      "bindings": {
        "osquery": {
          "table": "docker_image_labels",
          "min_osquery": "5.10.0"
        }
      }
    },
    "state_dirs": {
      "kind": "file",
      "match": "home-dir",
      "platform": "all",
      "bindings": {
        "osquery": {
          "table": "file",
          "min_osquery": "5.10.0"
        }
      }
    },
    "binaries": {
      "kind": "file",
      "match": "home-prefix",
      "platform": "all",
      "bindings": {
        "osquery": {
          "table": "file",
          "min_osquery": "5.10.0"
        }
      }
    },
    "process_paths": {
      "kind": "proc",
      "match": "home-prefix",
      "platform": "all",
      "live": true,
      "bindings": {
        "osquery": {
          "table": "processes",
          "min_osquery": "5.10.0"
        }
      }
    },
    "model_stores": {
      "kind": "file",
      "match": "home-prefix",
      "platform": "posix",
      "bindings": {
        "osquery": {
          "table": "file",
          "min_osquery": "5.10.0"
        }
      }
    },
    "ports": {
      "kind": "port",
      "match": "exact",
      "platform": "posix",
      "retired": true,
      "bindings": {
        "osquery": {
          "table": "listening_ports",
          "min_osquery": "5.10.0"
        }
      }
    },
    "deb_packages": {
      "kind": "deb",
      "match": "exact",
      "platform": "linux",
      "bindings": {
        "osquery": {
          "table": "deb_packages",
          "min_osquery": "5.10.0"
        }
      }
    },
    "rpm_packages": {
      "kind": "rpm",
      "match": "exact",
      "platform": "linux",
      "bindings": {
        "osquery": {
          "table": "rpm_packages",
          "min_osquery": "5.10.0"
        }
      }
    },
    "desktop_ids": {
      "kind": "desktop",
      "match": "exact",
      "platform": "linux",
      "value_pattern": "^[A-Za-z0-9][A-Za-z0-9._+-]*\\.desktop$",
      "bindings": {
        "osquery": {
          "table": "file",
          "min_osquery": "5.10.0"
        }
      }
    },
    "systemd_prefixes": {
      "kind": "unit",
      "match": "prefix",
      "platform": "linux",
      "bindings": {
        "osquery": {
          "table": "systemd_units",
          "min_osquery": "5.10.0"
        }
      }
    },
    "msix_families": {
      "kind": "msix",
      "match": "exact",
      "platform": "windows",
      "value_pattern": "^[A-Za-z0-9][A-Za-z0-9.-]*_[a-z0-9]{13}$",
      "bindings": {
        "osquery": {
          "table": "programs",
          "min_osquery": "5.17.0"
        }
      }
    },
    "uninstall_keys": {
      "kind": "uninstall",
      "match": "exact",
      "platform": "windows",
      "bindings": {
        "osquery": {
          "table": "registry",
          "min_osquery": "5.10.0"
        }
      }
    }
  },
  "agents": [
    {
      "id": "claude-desktop",
      "name": "Claude Desktop",
      "classification": "Desktop assistant",
      "platforms": [
        "darwin",
        "windows"
      ],
      "identifiers": [
        {
          "route": "bundle_ids",
          "value": "com.anthropic.claudefordesktop",
          "status": "current",
          "proof": [
            {
              "binding": "osquery",
              "scenario": "10-desktop-apps",
              "platform": "darwin",
              "run": "40470852600",
              "os": "15.7.9",
              "arch": "arm64",
              "agent_version": "1.46388.4"
            },
            {
              "binding": "osquery",
              "scenario": "10-desktop-apps",
              "platform": "darwin",
              "run": "40470852600",
              "os": "26.6.2",
              "arch": "arm64",
              "agent_version": "2.31226.1"
            },
            {
              "binding": "osquery",
              "scenario": "40-browser",
              "platform": "darwin",
              "run": "40470852600",
              "os": "15.7.9",
              "arch": "arm64",
              "agent_version": "1.46388.4"
            },
            {
              "binding": "osquery",
              "scenario": "40-browser",
              "platform": "darwin",
              "run": "40470852600",
              "os": "26.6.2",
              "arch": "arm64",
              "agent_version": "3.1623.0"
            }
          ]
        },
        {
          "route": "homebrew",
          "value": "claude",
          "status": "current",
          "proof": [
            {
              "binding": "osquery",
              "scenario": "10-desktop-apps",
              "platform": "darwin",
              "run": "40470852600",
              "os": "15.7.9",
              "arch": "arm64",
              "agent_version": "1.46388.4,50e62f90a2c85243eef42913398f7c8f1534abef"
            },
            {
              "binding": "osquery",
              "scenario": "10-desktop-apps",
              "platform": "darwin",
              "run": "40470852600",
              "os": "26.6.2",
              "arch": "arm64",
              "agent_version": "2.31226.1,8576520051724193e9f74fc538f9ce8125e9ddd2"
            },
            {
              "binding": "osquery",
              "scenario": "40-browser",
              "platform": "darwin",
              "run": "40470852600",
              "os": "15.7.9",
              "arch": "arm64",